{
  "schema_version": "melissa.worker-type/v1",
  "id": "unity",
  "name_tr": "Unity Worker",
  "modules": [
    "game"
  ],
  "declared_platforms": [
    "windows",
    "linux"
  ],
  "purpose_tr": "Unity batchmode/editor API, build, test ve gameplay bridge işlerini çalıştırır.",
  "tool_families": [
    "game"
  ],
  "requirements_tr": [
    "Unity ve platform modülleri",
    "lisans/aktivasyon koşulu",
    "bridge/test framework sürümü"
  ],
  "isolation_contract_tr": "Editor ve test runtime ayrı işler; proje script'leri izole executor kapsamında.",
  "job_contract": {
    "required": [
      "task_id",
      "invocation_id",
      "attempt_id",
      "lease_generation",
      "permit_ref",
      "arguments_digest",
      "input_artifact_refs",
      "limits",
      "cancellation_ref"
    ],
    "returns": [
      "status",
      "effect_status",
      "exit_code",
      "artifact_refs",
      "evidence_refs",
      "resource_usage",
      "error_category",
      "cleanup_status",
      "duration_ms"
    ]
  },
  "resource_policy": {
    "authority": "task_and_broker",
    "limits": [
      "wall_time",
      "cpu",
      "ram",
      "disk",
      "output_bytes",
      "network_scope",
      "gpu_vram_when_applicable"
    ],
    "unbounded_jobs": false
  },
  "lifecycle": [
    "registered",
    "ready",
    "leased",
    "running",
    "cancelling",
    "reconciling",
    "finished",
    "quarantined"
  ],
  "acceptance_checks_tr": [
    "editmode/playmode ayrı rapor",
    "build artifact açılabilir",
    "bridge sürüm uyuşmazlığı açık hata",
    "lisans/timeout başarı sayılmaz"
  ],
  "implementation": {
    "definition": "complete",
    "executor": "not_implemented",
    "local_acceptance": "not_run",
    "live_acceptance": "not_run"
  }
}
